{
  "schema": "pq-agent-batch/signed-action/v1",
  "chainId": 20143,
  "settlement": "0x0e1ad57bfb7e25656de899571be624559d871d10",
  "agentId": 4,
  "nonce": 1,
  "expiry": 1794726000,
  "modelHash": "0xceba79c4a5c919dc37075f11a5d1b69adf64b71b7c078a68de14e60c8453a2b4",
  "pkHash": "0x7c2c8a8b98c34df4a50204357e33cdd8155a64be11ac2fcd2c7b395d13271602",
  "order": {
    "side": "sell",
    "amountIn": "10000000000000000000",
    "minAmountOut": "1"
  },
  "orderBytes": "0x00000000008ac7230489e80000000000000000000000000001",
  "message": "0xaf17232b533743d5a75491aa97c853f63eae2896bf43b7d5de2dc0c9cd5264e60000000000004eaf0e1ad57bfb7e25656de899571be624559d871d100000000400000000000000016af95870ceba79c4a5c919dc37075f11a5d1b69adf64b71b7c078a68de14e60c8453a2b400000000008ac7230489e80000000000000000000000000001",
  "publicKey": "0xfe689358da3fe9dfb4f9c8f2523357a0073aab396e848c8650b38739f7675ee243a37c1cb6dda074c6d15c6b119ee47822d745e1d473b5631e22c65d8ec47393aba2d65dde413bb9f9041c7ff18a6a34cf9a58485a1516445f2191bae34d283bcbca0a0520c9ff90af8963cb288de8f4df68a2ef890487de0ce46b0a870ba4c48c5f573e15cea8e0ab3f3a0b79fb28bb3b4274053044deae9b7882c5eca5c796a4d57831fe915036e7a850b4e56e6b3f631a9a64bfa7afa060d84c343dcacb0e364da6d5729a1e77f7b103a339110a4a1144d851b5f5b62bc35e3b3b47ff9bdc280271f1eb2dbd76b2f4d65caf274cfe34f7c7f3f60357d5af2946798e04ebb67b8bb4dd059e9fbc77cb87c0976c2e960014e89e7090a4c26831c67a3511f35594f9f8230c68e7f5199e6e199c26985e681e68b2366ae962aa607f47ae7c1df0d775ac365eb1bdc37d134b6bac672580ef58460f85fd2f4670d0698665a5cc2f3e122954252b4240381d0f1968f4bd0a5c518eba65c0e88b38d09ba9a82676ad5f5367a01890e1499ae88446eb55c7ad18410a24e424078cd9692d30ff95b5e89debdd69c3d4bee0211038d1c9e18ec0663845e2eb71584a3e0a1886e620df3401cd6eaf52971bf5bc0c40d60cc9f9061d604160d1d0c223b2027c379aa729518a996bf1e0a349ffedaa7a92b5d3c3dd7757c62a5e514f0b43ae2d3617e2ac382b2da51f6d07995a4da749cd32ce90bffb0e7de75a2337ea35ff7de73e6ad65747bfe6129520d43a4ada1c7d5c47e715e30f81865aca207d6f49f376b1a74645d2f1a32292eccbd308699bf6e30863175d7631622706f751e8c93dadf068d3f273ada3cd2256fa590e9fe94dfdf69e9e7ef3491e9b0ac2e8534dde318ba6c534e1868999a89090f649700be79f1ea3d30839868cbd2a56026ec53326397a3d22b8f8dbcb75ec507be0b04095321824a81bcaa4e4456061dcaa2ae98afc6d8df7ba4645b499c7ebc43aba713a921cc9d681e099bf477b48f199c9d661634fa3c93940c38dca2fa5182ed6cc3e3d5987edd4db2ee0a0e497b22bfbbc4b35990874e3cf4f26eb5bab6d742cb25b54c1a14b84156b11cd6dad0b4642846e917ac46aee57c916721d07b6f9e16fc47a67531f810d90d7272ac872a8347b3de1b8dcd015c56742b9d8ebabb1347bc489840a39a69455e1706a7519db65e9ebf602f0e7015be4e2b6739965087aed6e9d353c5bb07ef2e7506cb1aa9ba840cbca4b79baac966778f8e9ab10f90a43729612dbc405e4e74b753a3df6ad1d268feebaf69ffee78b158b0eb93b271afcbb38d2ddbe06fd9a31734376843d67a4a28c2dac814b24696b8ff701b0a8a25d20855da2967d8fe232b7262c3674848b41fb704d7524c1f878739dd9fe1798a4da1b982d63e7fbe6398419f87e1c07a25c26ae3cafcee8d6780a0544741f4b24525e0a99aede3c7f1b5714043bed7e1ed65966c62a87761569e5fe8d15812be8c37e7fbe97bc0030403aacaa6b53ff4b1c0e13335e0d4e0038b24cd9a1140f595a83af1fd86f43bece2a878613a6bd5666d21fdb5446a77fc779b45af431dc65e0dffcab52c2dc3b0337fcf699790aa22d616ab935f3c7c533499bcb870ad064f2cad070814c3ce37a979d4d0b5ecd9f34aa98038811e1e9ca168af865a8bdb2e4d4dd3c63ffb122a09c7be6a43935477ecd5e9acf1fb6bcdb9d1c806a21f3167ee1769910a80e7f8a30ebb52b48066d25a129f10f40eb18cd8a9345896d44f0afac7cd87c538c682d7ed164d60c390156c1967c7b23447eff270e1fc603705d6984b7a186041d82f89c5719f47875ad8c8c02dcf9f45f8b6d7bd00745f2d2eae9ce67bb6c5d93a0f0d123e9cf9d15b756c32f3b53b102eab6a9e580bc82601bc12068ebe9fa88010628b42fbeb6a4ff17667e8e74e0f46827d05044333e8af495a4fdfe17f1a84bb56f12749e31eff94da4d3b08ecb5ea5af0c7b699395df5891a17d2fea66a8e0fd7ba6a8c9497136d48b0cd9b8d486f334426f07867ecacd86841fe126476c038da6eab16b7a2066dae1e9fdd1d2838e8ab331297a5bfe3cf2666403bb5dbba8a7a885abba7a04f24a933e01e185e1dfb9cff2a650a93ba5b338332a99cedc5d077461cd2df3cb83b291571a9c911a8c004f891cb0395e23e040e10b78e317fe55a0c94daee595feaff39a5153f0fb8709b3707c75aa8b850127efbb16d64c857e27997dd09f1349655c91a873a1f275e8494f80ce1aabbd5bf84b1a768025e8da0d65d8bdc9c0410822af5fea41ce2479a214f9488407573aade99f23cb0e1c9f84abeb538b8214fef33a435c3f45e6d3fe94f82b181ca8c0f82c1c09b6b5975e9a792c6a62aa7779f988126173e4a1d9dbd5bf1d0b1ca322d22322e2f03278c69ed37ccea290e9e378c44dc2a11450db570a370fd5c49ee09d30eb1af9f4caca3c91b710f02b168e75e55c493ab5b3983594e308f8c00bbfdabc619ec8a9c5f9c737770767ce3401ad9efa762981c6c30e42b22cb105658e8f74db2e9555bba777f5d92020381f6e898841c52b83495b4078036db6fb0a8acadfebecf06abb666ac0552c760593770a6788a3f7e9639b54c5fce2b538b7cb10e529f0c28fe1d70b01f0fc58135fb3f92f2c3e366300fc6f433b29ed4492078655d63d5ce899fe8900e5716363970cd30e38c5c8e2de0207816b04c93449387a1305ea70e4e22a22537f3111253c97009bf488",
  "signature": "0x2083bd22fc69059e10ce3eef3dcf58cf9e833eb663dc6dd89c218f1ce136aa6285b98eb68afec695d5da29eb0e544e99061e900e2e1e6a2d1be4e36306c6f388a4f6a1fa16bc1fb86ed3223247bf70ac691fb011e212d58f015e2e207be4908fe4fc197a3a2d502f75b01235e5fee6e51b8df40738d6e6189ba910a423f86194d5a24320f37bd56c650833dd2a25e5b0cc809a0cf05a31076fb5441d9fc66cac6483026e9c5a465619ce32e6b6a2a0044b314d4f045baa9dc1d011b73bf53ca14430017221e101b1324d07fa10bb83e43d82d8e6d3f971311f0c808e91159997d7197734afdb9ca5a83cd8d486b15afca8492eb6cb9854faaa97fea4e8255e108b7fa17b494caa987a2095fdb1500ea95ab341b3493820a56dbda054ea02439f7680268e29a5e94436599d2f59869fea491f7429f98a3e423cbba4b2f6306ec50a1c7eac7279a85d9586e1507ec118ef00e1c953cbf84711d151fc767707cf5e9e578cbd2ec9b041c0efd598cc59c706b3815f7c5132cef3d4960aaecf9b5fe8f1198fad2b3d9a7cd0e7b91876c934c610e7a69c8fa1bf3c3b5791c3875d2e8723c79c7e31186185c61eb15ef7a84f3b3d638735851a1b08664ef198f857d5d2c13625130d02897921be6f613decf31e185ddbabc04ba02a671fefce3c52e20a65613d7906ca59044dbf55af1a36525dd4ed1a53cb068c89254e222efefca1b7f4b7584d00f072aaa29f8c4860673ee57bb7a5722823e5032bbf08223cacd77894f34485776efed21d148242a15abdb30389afa013fd3dacd65fc2c158dc342fa3f34f62c601db72391788a0668cd35a72493dcddbe2813bfbb720eea9570db58870c243245220c06b0a37aa214ed8a5c52361d3e7f6abfab2119ec29102aef034906c8a608e403079fe21599eae7c9b18523c816faf49727f4798f79ea7edd88cd838fcc8c0d4726bfa314d21a6cf7de09c232ce1cc6835959cd4d8a3017f3026e46876c22d8c01b407544848b8925428ade2c90503aa62bffd0a364cdc5b63c05286be63ba31f418e1cbcdef8fc0f2b1c48c33346aef7e77cf1c99537645416ccfa74b01cd7eb168a4622a5af114126ecd2651da06c4ccbdce0bd604f9feebf96adfefaa12a90279f074ae9783d8f215739979599f8d203044396e7242b0fa1e30ee1cf48b4655785d80a19b3731ed628cfecc05f59617e6e5ba48d6f03d9c4094d1a8340caf146d7a7f23b31cca6783f5c7951791c974e72c5d1d8d7a550e03f0505f3273b2173904de9e3e726cf7bd175efd67ce95b83bde0022e016634bc61e1814f71262c604fb8cd9358c45012406cf04e6fcee1e42f067da48acdac7012fc8014b22b8c5736379c610fdc1455413edb2282e3d0fd571c57ecdb50f7a3a211cdd61e78125905eadd4b1f8bf1310b542eb636b5976453d923e47d150954d64aec529f37d4fab3ccbca1e29ce9dab058a6f1a91a9ae9532f7919e0cb9d3b6ca652ad9e457cf5524b1f72f633cfd3361c34cd1adc817970f5d33eb4a0778a37b30b86b33b1a663a5887a15faccf17bab6b4102e4e1ac554c06d88d96450517aa6372ea4992c8a05bb9547acd015e8c7c4fe22ed0d1503ede741ac50931ea3cd44acb3441791edd0be80352f2467394ee4899e1f90f6ebf4ea8768ce41d9514afd009fcc27aa31256d27af42c4b38ef3b278feed1c7b42eda74418740072aa6100cf5228d2bddd0e3925bffd2057cf6a666f9c2f3166c1a5128e924486d9d190637950fca88726bef713705b90877d1f3a384a0922b8d36479cc116366890c38d8397866335eb0a191ed0ceb3cdc3f8050d951350c1707367584585ee167fc9588eb42cfe2481b576ac58001ee6d8f84f57eca58057a857af46b2000d2d4a1c99c6485d6d99459c7fd007f54ddb2d8d03f999ebd03e1b1e97df2f0f09bc09feb0a968ecac3ab253e490310772b029683df3b0bf8eacdd0fedf7cece39a2347e8877deb180425ac0212c079729fdb7630a4d4e1893061664bd16ccade918f55df4030cd49c2a5383f36fbd09dc77c82efbb5eeb098952403c9f90a643e2137f4939d410c8d8bfc15dde8bfbc9bbb9f97e0ccb368b431f512457f7c0ed8e73c4c6fbbab5c423f55df9657d76eb70d2644cc9c7647831cb232cba7c79323035b6148d96b130f2b7b8ab877ccf23bd60d6e511691abbfbb0e9856c8211f0eca39b6e8abecfbc2e28d7b7032c341dd11398f60027d9029019b517825f4f55db581429cbc495019e80b348c3bd521698a8d0d2b7602067f14256d272ccef82824bd3b3f8f79cc1d9c8155a9dae6ae2d54f610ddb0a0fa99c236a7833411a8dbe6f29fe208e498ef7caea1b443c93530a17907ae266c453a05fef9ded4d921d6eaae65aba970d1ba7ac6aaa86ba7d491b3722b634e03fe2aad57b6e37fbf4aab63176606a5ce282c2fe3d3706347dea1095a88fdf01562077a39934e94460231c9981ae551d2958b234dcc4dd3e3bb5d8e6c3ff773ccef64cd3bc1889e099f71618822b81df9972b45c3cfce1e6b7dd983c58d3926c9290bdd960dce24f7fff493d60c6480431b8184313965f2f58422b81cd862403d22f6deda7697c8f712b8aea8604f494ccf5c5cf25ccdb4a4a2e8a01a9a71d7fd2b1c24ef67ab0dff21ecbfcfb41bdf425ac3737f279ed2284afe3520e70f220c61b05f077340e97008c3531bae6ef1789e326f1523ca45e90527cb63a921149819987539135ed44741616c06beaf4677410da762b078b5e5c8ca239a7eb729f578fb10f62454bb8532699ae90b0e8ce3e42716563366679710d12c217306011b5e31cca9af65530a437f531a1240badc4dde2242f823f2e77b4c17888aadc8f38e5df67c98991c49e099eb4d5dbf370c4cb74d533d8a4d7e40dac22edf74b5801755ea6d218cd4aac7b51b15e8952dbd796a13f0936c202d7605043958bd6b6da8a2267df74e3c1873f989ad06aa84455f69c0886da5539a0245aefe55ed86755fe31cdbbf380256e63002aa01209c7222f2832841d5b6638e329dfac06d37599d761a782d5f99521ef8ba577634a75767c21f9fd6888a03cfd14fe5d25970d1c6888caf34287143eb9f7fb2ae9e9e0ac31a927dc66a7ff812eacf3e416c7b453ef1232e8965cf66c4c6c192ac62bf965e29793005c7b1f8a74e670dc2962ab100a06c8cfbeec39849ef138f16e4742b0c5cb2435d784264ee10b604689155cbe70a8ad7dab57935b5e100853094d484f25f160f74c9a59a3eebb0531b0349b3740012e2c08e34f35c483131ccf0b0ee110d0ff7fdfa3588aa2212fa27b74a81c38d4d3624ca44d6c1b124f3a25c110fee74a526219d4670286b0e5a924a0a8acb602ebe0f5ba199aeba237589448ae4b769ae04b00cb5900b0aca07395d30a0990b9f6b5f5c1d962bf8bd2f41c2953bf596c2d4560f8daffefa11e431a88fecd697bf46d7b3a2216d3edb6df1697b2d48e48129227696f2339e1e9d47ed7b10f47fe006eb74137891c83869c20d3024910cf5f56e891d94f52dae49dbb88059778da56a145cc3b14c33c2d3579d8bf7df0a810263ecf9901130bf1ef6d14a99fed134c95577f9fd91904875e6e2b16774c35cbccddc66664526093b7114a8772df6fe32f3432496c8b85d5bc69fd72f96a0ac9801a7a826803dc5ab038e4b3f301290e274dc1965053b23